{
  "schemaVersion": "sprinkler-assembly/3.0",
  "name": "你的現場・待補尺寸",
  "mode": "field",
  "units": "mm",
  "displayUnit": "cm",
  "coordinateSystem": "right-handed-Z-up",
  "sources": [
    {
      "id": "store",
      "kind": "user",
      "title": "材料行貨架長度：使用者確認 cm",
      "locator": "本對話：IMG_4469～4471；使用者「單位是cm」",
      "note": "確認標籤單位；尚未逐支量端面總長、確認口徑或存量。13 標籤仍被遮擋。"
    },
    {
      "id": "sgp-reference",
      "kind": "supplier",
      "title": "昇億／遠東 SGP 15A 尺寸公開表",
      "locator": "https://www.snyi.com.tw/product-femco04.html",
      "note": "15A 外徑21.7、壁厚2.8mm。只是供應規格參考，未認定貨架實物為SGP或此品牌。"
    },
    {
      "id": "thread-guide",
      "kind": "manufacturer",
      "title": "Swagelok MS-13-77 螺紋識別指南",
      "locator": "https://www.swagelok.com/downloads/webcatalogs/EN/MS-13-77.pdf",
      "note": "PDF第13、21、26頁；ISO7-1 1/2為14TPI。識別數值不是螺紋檢驗尺寸，也沒有通用鎖緊圈數。"
    },
    {
      "id": "soda",
      "kind": "manufacturer",
      "title": "碩達立布品名與產品資料",
      "locator": "https://www.soda-chen.com.tw/about-us.html",
      "note": "立布製造商的品名與牙規範圍，不代表照片實物來源。"
    },
    {
      "id": "demo",
      "kind": "assumption",
      "title": "幾何與裝配驗證示例",
      "locator": "本檔 SeedFactory",
      "note": "所有示例接頭尺寸、圈數上下限、吃入深度及灑水頭基準偏移，均非廠商安裝許可。"
    },
    {
      "id": "definition",
      "kind": "definition",
      "title": "本工具座標及尺寸基準",
      "locator": "schemaVersion sprinkler-assembly/3.0",
      "note": "固定出口端面為原點；Z向上；每個接頭有自己的端面、局部軸向和角度零位。"
    },
    {
      "id": "pending",
      "kind": "measurement",
      "title": "現場待量測",
      "locator": "尚未提供",
      "note": "null是缺資料，不是零。"
    },
    {
      "id": "edit",
      "kind": "user",
      "title": "本次手動輸入，待覆核",
      "locator": "本機介面",
      "note": "手動改值不自動變成廠商資料或已量測資料。"
    }
  ],
  "thread": {
    "family": "unknown",
    "nominal": "待確認",
    "tpi": {
      "value": null,
      "unit": "tpi",
      "status": "unknown",
      "sourceRef": "pending",
      "basis": "量牙規後填寫"
    },
    "starts": 1,
    "hand": "right",
    "identityConfirmed": false
  },
  "catalog": [
    {
      "id": "pipe",
      "name": "雙外牙立布",
      "kind": "nipple",
      "representation": "tube-envelope",
      "dimensions": {
        "length": {
          "value": null,
          "unit": "mm",
          "status": "unknown",
          "sourceRef": "pending",
          "basis": "待量測／型錄對型號"
        },
        "outerDiameter": {
          "value": null,
          "unit": "mm",
          "status": "unknown",
          "sourceRef": "pending",
          "basis": "待量測／型錄對型號"
        },
        "wall": {
          "value": null,
          "unit": "mm",
          "status": "unknown",
          "sourceRef": "pending",
          "basis": "待量測／型錄對型號"
        },
        "threadZone": {
          "value": null,
          "unit": "mm",
          "status": "unknown",
          "sourceRef": "pending",
          "basis": "待量測／型錄對型號"
        }
      },
      "identityConfirmed": false,
      "threadFamily": "unknown",
      "nominal": "待確認",
      "material": "待確認",
      "note": "資料與幾何均不代表照片實物已辨識。"
    },
    {
      "id": "socket",
      "name": "雙內牙接頭",
      "kind": "coupling",
      "representation": "tube-envelope",
      "dimensions": {
        "length": {
          "value": null,
          "unit": "mm",
          "status": "unknown",
          "sourceRef": "pending",
          "basis": "待量測／型錄對型號"
        },
        "outerDiameter": {
          "value": null,
          "unit": "mm",
          "status": "unknown",
          "sourceRef": "pending",
          "basis": "待量測／型錄對型號"
        },
        "wall": {
          "value": null,
          "unit": "mm",
          "status": "unknown",
          "sourceRef": "pending",
          "basis": "待量測／型錄對型號"
        },
        "threadZone": {
          "value": null,
          "unit": "mm",
          "status": "unknown",
          "sourceRef": "pending",
          "basis": "待量測／型錄對型號"
        }
      },
      "identityConfirmed": false,
      "threadFamily": "unknown",
      "nominal": "待確認",
      "material": "待確認",
      "note": "資料與幾何均不代表照片實物已辨識。"
    },
    {
      "id": "elbow",
      "name": "90°雙內牙彎頭",
      "kind": "elbow90",
      "representation": "swept-envelope",
      "dimensions": {
        "centerIn": {
          "value": null,
          "unit": "mm",
          "status": "unknown",
          "sourceRef": "pending",
          "basis": "待量測／型錄對型號"
        },
        "centerOut": {
          "value": null,
          "unit": "mm",
          "status": "unknown",
          "sourceRef": "pending",
          "basis": "待量測／型錄對型號"
        },
        "bendRadius": {
          "value": null,
          "unit": "mm",
          "status": "unknown",
          "sourceRef": "pending",
          "basis": "待量測／型錄對型號"
        },
        "outerDiameter": {
          "value": null,
          "unit": "mm",
          "status": "unknown",
          "sourceRef": "pending",
          "basis": "待量測／型錄對型號"
        },
        "wall": {
          "value": null,
          "unit": "mm",
          "status": "unknown",
          "sourceRef": "pending",
          "basis": "待量測／型錄對型號"
        },
        "threadZone": {
          "value": null,
          "unit": "mm",
          "status": "unknown",
          "sourceRef": "pending",
          "basis": "待量測／型錄對型號"
        }
      },
      "identityConfirmed": false,
      "threadFamily": "unknown",
      "nominal": "待確認",
      "material": "待確認",
      "note": "資料與幾何均不代表照片實物已辨識。"
    },
    {
      "id": "head-datum",
      "name": "灑水頭對位基準",
      "kind": "datum",
      "representation": "datum-only",
      "dimensions": {
        "datumOffset": {
          "value": null,
          "unit": "mm",
          "status": "unknown",
          "sourceRef": "pending",
          "basis": "待量測／型錄對型號"
        },
        "threadZone": {
          "value": null,
          "unit": "mm",
          "status": "unknown",
          "sourceRef": "pending",
          "basis": "待量測／型錄對型號"
        }
      },
      "identityConfirmed": false,
      "threadFamily": "unknown",
      "nominal": "待確認",
      "material": "待確認",
      "note": "資料與幾何均不代表照片實物已辨識。"
    }
  ],
  "assembly": {
    "root": {
      "positionMm": [
        0,
        0,
        0
      ],
      "quaternionXYZW": [
        1,
        0,
        0,
        0
      ],
      "threadFamily": "unknown",
      "nominal": "待確認",
      "sourceRef": "definition",
      "threadZone": {
        "value": null,
        "unit": "mm",
        "status": "unknown",
        "sourceRef": "pending",
        "basis": "固定出口可接合深度待確認"
      }
    },
    "instances": [
      {
        "id": "P1",
        "catalogRef": "pipe",
        "lengthOverride": {
          "value": 200,
          "unit": "mm",
          "status": "user_confirmed",
          "sourceRef": "store",
          "basis": "貨架20cm標籤；尚未確認含牙端面總長"
        }
      },
      {
        "id": "S1",
        "catalogRef": "socket"
      },
      {
        "id": "H1",
        "catalogRef": "head-datum"
      }
    ],
    "joints": [
      {
        "id": "J1",
        "parent": "root",
        "parentPort": "out",
        "child": "P1",
        "childPort": "A",
        "zeroDefinition": "n=0時的自訂記號；e0由端面實測，不是露牙數",
        "referenceTurns": 0,
        "insertionAtReference": {
          "value": null,
          "unit": "mm",
          "status": "unknown",
          "sourceRef": "pending",
          "basis": "端面零位吃入深度待量測"
        },
        "angleAtReferenceDeg": 0,
        "minimumTurns": 1,
        "maximumTurns": 2,
        "mode": "continuous",
        "phaseTurns": 1.5,
        "fixedTurns": 1.5,
        "currentTurns": 1.5,
        "limitsSourceRef": "pending",
        "limitsConfirmed": false
      },
      {
        "id": "J2",
        "parent": "P1",
        "parentPort": "B",
        "child": "S1",
        "childPort": "A",
        "zeroDefinition": "n=0時的自訂記號；e0由端面實測，不是露牙數",
        "referenceTurns": 0,
        "insertionAtReference": {
          "value": null,
          "unit": "mm",
          "status": "unknown",
          "sourceRef": "pending",
          "basis": "端面零位吃入深度待量測"
        },
        "angleAtReferenceDeg": 0,
        "minimumTurns": 1,
        "maximumTurns": 2,
        "mode": "continuous",
        "phaseTurns": 1.5,
        "fixedTurns": 1.5,
        "currentTurns": 1.5,
        "limitsSourceRef": "pending",
        "limitsConfirmed": false
      },
      {
        "id": "J3",
        "parent": "S1",
        "parentPort": "B",
        "child": "H1",
        "childPort": "A",
        "zeroDefinition": "n=0時的自訂記號；e0由端面實測，不是露牙數",
        "referenceTurns": 0,
        "insertionAtReference": {
          "value": null,
          "unit": "mm",
          "status": "unknown",
          "sourceRef": "pending",
          "basis": "端面零位吃入深度待量測"
        },
        "angleAtReferenceDeg": 0,
        "minimumTurns": 1,
        "maximumTurns": 2,
        "mode": "fixed",
        "phaseTurns": 1.5,
        "fixedTurns": 1.5,
        "currentTurns": 1.5,
        "limitsSourceRef": "pending",
        "limitsConfirmed": false
      }
    ],
    "variableInstance": "P1",
    "datumInstance": "H1"
  },
  "stock": {
    "sourceRef": "store",
    "labelUnit": "cm",
    "lengthBasis": "shelf-label",
    "compatibleIdentityConfirmed": false,
    "labelsCm": [
      3,
      4,
      5,
      6,
      7,
      8,
      9,
      10,
      11,
      12,
      14,
      15,
      16,
      17,
      18,
      19,
      20,
      21,
      22,
      23,
      24,
      25,
      26,
      27,
      28,
      29,
      30
    ],
    "excludedNotes": "13未讀清；單位cm已確認，含牙端面總長與規格相容未確認。"
  },
  "target": {
    "drop": {
      "value": null,
      "unit": "mm",
      "status": "unknown",
      "sourceRef": "pending",
      "basis": "固定出口端面→目標面距離"
    },
    "toleranceMm": 0.5,
    "uncertaintyMm": 0,
    "datumLabel": "灑水頭指定對位面（非外觀底端推測）",
    "axisToleranceDeg": 1,
    "strategy": "adjustable"
  },
  "notes": [
    "螺紋以端面、導程與套接變換計算；不生成加工牙型。",
    "包絡實體可供尺寸檢查，不是製造級或消防驗收模型。"
  ]
}